language,keywords,response
es,"computadora lenta,lenta,windows,performance","Reinicia el equipo, cierra programas innecesarios y confirma si el disco esta casi lleno. Si el problema sigue, EZEMTECH puede revisar malware, programas de inicio, salud del disco y memoria."
en,"slow computer,slow,windows,performance","Restart the computer, close unnecessary apps, and check whether the drive is almost full. If it continues, EZEMTECH can review malware, startup apps, drive health, and memory."
es,"virus,malware,popups,seguridad","No ingreses contrasenas ni datos bancarios hasta que el equipo sea revisado. EZEMTECH puede hacer limpieza de malware, revisar extensiones del navegador y reforzar la seguridad."
en,"virus,malware,popups,security","Do not enter passwords or banking details until the device is checked. EZEMTECH can clean malware, review browser extensions, and improve security."
es,"internet,wifi,wi-fi,red,router","Prueba reiniciar modem/router y verifica si otros equipos tienen internet. Si solo falla un equipo, puede ser configuracion de red, drivers o DNS."
en,"internet,wifi,wi-fi,network,router","Restart the modem/router and check whether other devices are online. If only one device fails, it may be network settings, drivers, or DNS."
